id,category,title,type,thumbnail,description,content,videoUrl
km-001,SOP Budidaya,Panduan Pemupukan Berimbang,Artikel,https://images.unsplash.com/photo-1621506289937-a8e4df240d0b?auto=format&fit=crop&q=80&w=800,"Panduan teknis mengenai dosis dan waktu pemupukan yang paling tepat untuk pertumbuhan optimal kelapa sawit. Mencegah pemborosan pupuk dan menjaga kelestarian hara.","Pemupukan berimbang adalah kunci utama dalam budidaya kelapa sawit. Dosis pupuk harus disesuaikan dengan hasil analisis daun dan tanah yang dilakukan setiap tahun. Pada tahap piringan, aplikasikan Nitrogen dan Kalium secara terpisah dengan jarak 3 bulan.",
km-002,Sertifikasi,Checklist Kelayakan RSPO,Dokumentasi Kegiatan,https://images.unsplash.com/photo-1586771107445-d3ca888129ff?auto=format&fit=crop&q=80&w=800,"Kumpulan dokumen persyaratan yang diperlukan kelompok tani untuk mengajukan sertifikasi RSPO tahun ini.","Dokumentasi kegiatan sosialisasi RSPO di Distrik Pelalawan. Proses mencakup pemeriksaan HGU, pengelolaan sempadan sungai, serta bukti nol-bakar.",
km-003,Tutorial,Video Penggunaan Traktor Mini,Video,https://images.unsplash.com/photo-1589923188900-85dae523342b?auto=format&fit=crop&q=80&w=800,"Tutorial langkah demi langkah mengoperasikan traktor mini untuk membajak lahan dengan aman dan efisien.",,https://www.youtube.com/embed/dQw4w9WgXcQ
km-004,Hama & Penyakit,Katalog Penyakit Tanaman Padi,Artikel,https://images.unsplash.com/photo-1500937386664-56d1dfefcb19?auto=format&fit=crop&q=80&w=800,"Identifikasi jenis-jenis penyakit yang paling umum menyerang tanaman padi unggul, beserta rekomendasi penanganan organiknya.","Penyakit Hawar Daun Bakteri (HDB) yang disebabkan oleh Xanthomonas campestris pv. oryzae merupakan ancaman utama. Pengendaliannya bisa menggunakan varietas tahan hama, jarak tanam legowo, dan menghindari genangan air yang terlalu menetap.",
km-005,SOP Budidaya,Penerapan GAP Pengendalian Gulma,Artikel,https://images.unsplash.com/photo-1592982537447-6f2c5c5ebddb?auto=format&fit=crop&q=80&w=800,"Prinsip-prinsip Good Agricultural Practices (GAP) untuk rotasi perawatan gulma di ring piringan agar tidak terhindar dari jamur ganoderma.","Metode melingkar (circle weeding) selebar 1.5 - 2 meter dari bonggol harus bersih total dari pakis maupun ilalang liar.",
km-006,Modul Pelatihan,Paket Training of Trainers (ToT),Toolkit Training,https://images.unsplash.com/photo-1552664730-d307ca884978?auto=format&fit=crop&q=80&w=800,"Kumpulan bahan presentasi, silabus, dan lembar kerja untuk melatih kader tani (ToT) terkait teknik penyuluhan pertanian modern.","Toolkit ini merangkum kompendium yang komprehensif, mulai dari metode pengajaran orang dewasa (Andragogi), susunan pertemuan rutin lapang, hingga kuesioner adopsi teknologi bagi petani peserta binaan.",
